cluster,timestamp,text
0,0.16s - 10.92s,"We have been a misunderstood and badly mocked org for a long time. Like when we started, we like announced the org at the end of 2015 and"
0,1112.21s - 1122.77s,"Second, we are building in public and we are putting out technology because we think it is important for the world to get access to this early to shape the way it's going to be developed,"
0,1153.83s - 1164.26s,"the technology and shape it with us and provide feedback we believe is really important. The trade off of that is the trade off of building in public, which is we put out things that are going to be deeply"
0,125.81s - 136.06s,"humans to create, to flourish, to escape the widespread poverty and suffering that exists in the world today and and to succeed in that old,"
0,1344.76s - 1355.68s,"and I also like, I get why this is such an important issue. This is a really important issue. But that somehow we, like somehow"
0,1355.68s - 1365.83s,this is the thing that we get caught up in versus like what is this going to mean for our future? Now maybe you say this is critical to what this is going to mean for our future. The thing that it says
0,1437.67s - 1447.83s,degree of alignment increases faster than our rate of capability progress. And that I think will become more and more important over time. And I don't know. I think we made
0,1572.69s - 1583.29s,different ways to answer that question that's aligned with human civilization and there's no one set of human values or there's no one set of right answers to human civilization. So
0,1583.29s - 1593.57s,I think what's going to have to happen is we will need to agree on as a society on very broad bounds. We'll only be able to agree on a very broad bounds of what these systems
0,188.68s - 199.24s,"companies, institutions and political systems that deploy check and balance this power, about distributed economic systems that incentivize the safety and human"
0,2110.5s - 2120.74s,"on earth would come together, have a really thoughtful, deliberative conversation about where we want to draw the boundary on this system. And we would have something like"
0,2120.74s - 2130.82s,"the US Constitutional Convention where we debate the issues and we look at things from different perspectives and say, well, this would be good in a vacuum, but it needs a check here."
0,2131.14s - 2142.67s,"And then we agree on, here are the rules, here are the overall rules of this system. And it was a Democratic process. None of us got exactly what we wanted, but we got something that we feel good"
0,2142.67s - 2153.15s,"enough about. And then we and other builders build a system that has that baked in within that. Then different countries, different institutions can have different versions."
0,2164.14s - 2176.74s,"their country. So we're trying to figure out how to facilitate. Obviously, that process is impractical as stated, but what is something close to that we can get to. Yeah,"
0,2187.46s - 2197.48s,"Like, I don't think it would work to just say, like, hey, un go do this thing and we'll just take whatever you get back. Because we have like, a, we have responsibility of we're the one putting the system out, and if it breaks,"
0,2197.48s - 2207.6s,"we're the ones that have to fix it or be accountable for it. But B, we know more about what's coming and about where things are harder, easy to do than other people do. So"
0,2207.6s - 2218.24s,"we've got to be involved, heavily involved, and we've got to be responsible in some sense, but it can't just be our input. How bad is the completely"
0,2239.12s - 2249.29s,"And again, we might. We might do that. I think what people mostly want is they want a model that has been rlh deft to the worldview they subscribe to. It's really about regulating other people's"
0,2441.4s - 2452.2s,"call refusals, refuse to answer. It is early and imperfect. We're again the spirit of building in public and bring"
0,2452.2s - 2463.08s,"society along gradually we put something out. It's got flaws, we'll make better versions. But yes, we are trying. The system is trying to learn questions"
0,251.09s - 261.45s,"man the critical perspective on major decisions various companies and leaders make, always with the goal of trying to help in my small way. If"
0,2879.16s - 2890.28s,"I think it's part of the way. I think we need other super important things. This is philosophizing a little bit like what, what kind of components do you think in"
0,2975.37s - 2985.41s,"scale the number of those interactions, like what kind of these things start getting integrated into human society and starts building on top of each other. I"
0,3232.13s - 3244.17s,"can make the world amazing and we can make people's lives amazing. We can cure diseases, we can increase material wealth, we can like help people be happier, more fulfilled, all of these sorts of things. And"
0,3244.17s - 3254.45s,"then people are like, oh well, no one is going to work. But people want status, people want drama, people want new things, people want to create, people want to like, feel useful,"
0,3256.06s - 3267.14s,"people want to do all these things and we're just going to find new and different ways to do them, even in a vastly better, like unimaginably good standard of living world. But"
0,3524.48s - 3536.2s,"little bit but I still was like advocating that we do it because I thought it was going to do really great. So like you know, maybe I thought it would have been like the"
0,3587.31s - 3597.39s,it's happening or not? Would we go about our day on the weekend or not? So I'll come back to the would we go about our day or not? Thing. I think there's like a bunch of interesting lessons from
0,3650.87s - 3661.93s,"have maximum impact in that world, to try to push for that kind of a world. And the decisions that we make are. There's probability masses, but weighted towards that. And"
0,4179.73s - 4190.05s,current worries that I have are that there are going to be disinformation problems or economic shocks or
0,4211.6s - 4221.76s,"So these systems deployed at scale can shift the winds of geopolitics and so on. How would we know if, like on Twitter, we were"
0,4307.46s - 4317.98s,get ahead of us in all sorts of ways and take shortcuts we're not going to take and we just aren't going to do that. How do you out compete them? I
0,4338.28s - 4348.44s,"so we don't have this incentive to capture unlimited value. I worry about the people who do but you know, hopefully it's all going to work out. But we're a weird org"
0,4348.44s - 4359.08s,and we're good at resisting. Like we have been a misunderstood and badly mocked org for a long time. Like when we started we
0,4421.95s - 4432.15s,things stand? We started as a nonprofit. We learned early on that we were going to need far more capital than we were able to raise as a nonprofit. Our nonprofit is still
0,4432.15s - 4442.41s,fully in charge. There is a subsidiary capped profit so that our investors and employees can earn a certain fixed return. And then beyond that everything else flows
0,4442.41s - 4452.65s,"to the nonprofit. And the nonprofit is like in voting control. Lets us make a bunch of nonstandard decisions, can cancel equity, can do a whole bunch of other things, can let"
0,4452.65s - 4462.97s,"us merge with another org, protects us from making decisions that are not in any shareholders interest. So I"
0,4462.97s - 4473.23s,think as a structure that has been important to a lot of the decisions we've made. What went into that decision process for taking a leap from nonprofit to capped for
0,4473.23s - 4483.43s,"profit? What are the pros and cons you were deciding at the time? I mean this was, it was really like to do what we needed to go do. We"
0,4483.43s - 4493.47s,"had tried and failed enough to raise the money as a nonprofit. We didn't see a path forward there. So we needed some of the benefits of capitalism, but not too much. I remember"
0,4493.47s - 4503.87s,"at the time someone said, you know, as a nonprofit, not enough will happen. As a for profit, too much will happen. So we need this sort of strange intermediate. Well, you kind of had"
0,4544.98s - 4555.62s,"going to do. We can try to like build something and talk about it and influence others and provide value and you know, good systems for the world. But they're"
0,4555.62s - 4565.74s,going to do what they're going to do. Now I think right now there's like extremely fast and not
0,4565.74s - 4575.89s,super deliberate motion inside of some of these companies. But already I think people are as they see the rate of progress already people are
0,4575.89s - 4586.25s,grappling with what's at stake here and I think the better angels are going to win out. Can you Elaborate on that. The better angels of individuals. The individuals and the companies. But
0,4586.81s - 4596.91s,"the incentives of capitalism to create and capture unlimited value, I'm a little afraid of. But again, I think no one wants to destroy the world. No"
0,4607.07s - 4617.15s,"we collaborate to minimize some of these very scary downsides. Well, nobody wants to destroy the world. Let me ask you a"
0,4669.02s - 4680.27s,"might corrupt you for sure? Look, I don't. I think you want decisions"
0,4680.27s - 4690.39s,"about this technology, and certainly decisions about who is running this technology to become increasingly democratic over time. We haven't figured"
0,4700.63s - 4710.89s,to think about this. To pass regulation for institutions to come up with new norms for the people working out together. That is a huge part of why we deploy. Even though many
0,4744.14s - 4754.19s,"if created has a lot of power. How do you think we're doing? Like, honest. How do you think we're doing so far? Like, how do you think our decisions are? Like, do you think we're making things not better or worse? What can we do better? Well, the"
0,4894.65s - 4904.69s,"of resolve in what we're doing and why and the importance of it. But I really would love, and I ask this, like, of a lot of people, not just if cameras are all in, like, any feedback"
0,5050.26s - 5060.51s,he has. He has driven the world forward in important ways. I think we will get to electric vehicles much faster than
0,5416.07s - 5426.09s,"So hopefully without the. Because there won't be that emotional load there. Yeah, the emotional load. But there might be pressure. There might be political pressure. Oh, there"
0,5436.41s - 5446.53s,"outside sources, from society, from politicians, from money sources? I both worry about it and want it, like, you know, to the point of we're in this bubble and"
0,5446.53s - 5458.07s,"we shouldn't make all these decisions. Like, we want society to have a huge degree of input here. That is pressure in some point, in some way. Well, there's a, you know, that's what, like, to some degree. Twitter"
0,5458.07s - 5468.31s,"files have revealed that there was pressure from different organizations. You can see in the pandemic, where the CDC or some other government organization might"
0,5880.94s - 5890.99s,"think, like, these systems will make a lot of jobs just go away. Every technological revolution does. They will enhance many jobs and make them"
0,5890.99s - 5901.39s,"much better, much more fun, much higher paid, and they'll create new jobs that are difficult for us to imagine, even if we're starting to see the first glimpses of them. But"
0,5912.89s - 5923.17s,"really got to worry. Like, even people who think they don't like their jobs, they really need them. It's really important to them and to society. And also, can you believe how awful it is that France"
0,5923.17s - 5933.37s,is trying to raise the retirement age? And I think we as a society are confused about whether we want to work more or work less. And certainly
0,5943.45s - 5953.57s,"we can move more of the world to better jobs and work to something, that can be a broader concept. Not something you have to do to be able to eat, but something"
0,5984.59s - 5994.92s,I think people work for lots of reasons besides. And I think we are going to find incredible new jobs and
0,5995.64s - 6007.28s,"society as a whole. And people's individuals are going to get much, much richer, but as a cushion through a dramatic transition and as. Just like I"
0,6007.28s - 6017.36s,think the world should eliminate poverty if able to do so. I think it's a great thing to do. As a small part of the bucket of solutions. I helped start a
0,6058.66s - 6068.86s,"sort of philosophical question looking 10, 20, 50 years from now, what does the economy look like? What does politics"
0,6068.86s - 6079.59s,look like? Do you see significant transformations in terms of the way democracy functions even? I love that you asked them together because I think they're super related. I think the economic transformation
0,6079.59s - 6090.71s,"will drive much of the political transformation here, not the other way around. My working model for the last five"
0,6111.33s - 6121.49s,"what you had as an individual before is society gets much, much richer, much wealthier in ways that are probably hard to imagine. I"
0,6121.49s - 6131.76s,think every time that's happened before that economic impact has had positive political impact as well. And I think it does go the other way too. The
0,6131.84s - 6141.92s,sociopolitical values of the Enlightenment enabled the long running technological revolution and scientific discovery process we've had for
0,6142.56s - 6152.6s,"the past centuries. But I think we're just going to see more. I'm sure the shape will change, but I think it's"
0,6162.67s - 6173.31s,"term is, but systems that resemble something like democratic socialism. I've talked to a few folks on this podcast about these kinds of topics. Instinct. Yes, I hope so. So"
0,6173.31s - 6183.32s,that it reallocates some resources in a way that supports kind of lifts the the people who are struggling. I am a big believer in lift up the
0,6235.31s - 6245.55s,and not need some sort of central planning betting on human ingenuity and this sort of like distributed process I believe is always going
0,6245.55s - 6256.43s,"to beat centralized planning. And I think that like for all of the deep flaws of America, I think it is the greatest place in the world because"
0,6256.43s - 6267.6s,it's the best at this. So it's really interesting that centralized planning failed some so in such big ways. But
0,6564.31s - 6574.39s,"a lot of disagreement. Where do you look for? Where can not even just now, but in the future. Where can we as a human civilization"
0,6930.01s - 6941.49s,"good and real bad, and we will minimize the bad and maximize the good. You have to carry the, the weight of that. How"
0,7158.09s - 7168.15s,and autonomy and authority to individual people and we try to hold each other to very high standards. And you
0,7334.88s - 7344.96s,"there pressure to kind of make a lot of money? I think most other companies wouldn't. Maybe now they would, it wouldn't at the time have understood why we needed"
0,7356.65s - 7366.81s,and I think they are unique in terms of the companies at that scale that understood why we needed the control provisions we have. And so those control provisions
0,7407.93s - 7418.37s,company into something very new. I think most CEOs are either great leaders or great managers.
0,7471.54s - 7481.62s,"totally wrong. I'm sure there's a lot of firing involved or a little twisting of arms or something. So do you have to rule by fear, by love? What can you say to the leadership aspect of"
0,7566.41s - 7576.77s,were thinking either. And is an example of where I think you see the dangers of incentive
0,7576.77s - 7586.97s,misalignment because as the Fed kept raising I assume that the incentives
0,7670.59s - 7680.79s,about it. But it kind of reveals the fragility of our economic system. We may not be done. That may have been like the gun shown falling off the nightstand in the first scene of the movie or whatever. There could be like other banks for sure. There could
0,7701.4s - 7711.88s,"to take away from this SVB thing is how much, how fast and how much the world changes and how little. I think our experts,"
0,7745.2s - 7755.24s,"will bring. What gives you hope in that shift? From an economic perspective, that sounds scary. The instability. No,"
0,7755.32s - 7765.64s,"I am nervous about the speed with which this changes and the speed with which our institutions can adapt, which"
0,7786.09s - 7796.13s,"The Better. And the. The upside of the vision here, just how much better life can be. I think that's going to like, unite a lot of us. And"
0,784.08s - 794.36s,"create a much better world? New science, new products, new services, whatever. And that's the one that matters. And understanding for a particular set"
0,8146.89s - 8157.6s,"going to do differently? The source of joy and happiness, of fulfillment in life is from other humans. So it's mostly nothing unless it causes some kind of threat. But"
0,8188.27s - 8198.83s,"a lot of different trajectories intermixed. I would have expected the society's response to a pandemic to be much better, much"
0,8198.83s - 8209.05s,"clearer, less divided. I was very confused about. There's a lot of stuff. Given the amazing technological advancements that are happening, the weird social divisions,"
0,8209.61s - 8219.85s,"it's almost like the more technological advancement there is, the more we're going to be having fun with social division. Or maybe the technological advancement just revealed the division that was already there. But all of that just"
0,8242.32s - 8252.4s,"but it's a triumph. It's a triumph of human civilization. 100 Google search. The search search period is incredible. The way it was able to do, you know, 20"
0,84.43s - 94.91s,"this current moment in the history of human civilization. I believe it is a critical moment. We stand on the precipice of fundamental societal transformation, where soon nobody"
0,8451.98s - 8462.62s,"feels like humanity was always moving towards. Yeah, that's what I was going to say is I don't think it's a small group of people. I think this is the, I think this is like the product"
0,8569.43s - 8579.67s,"and I think the pace is fast, but so is the progress. So the pace of capabilities and change as fast. But I think that also"
0,8579.67s - 8589.79s,means we will have new tools to figure out alignment and sort of the capital S safety problem. I feel like we're in this together. I can't wait what we together as a human
0,8589.79s - 8600.19s,"civilization come up with. It's going to be great. I think we'll work really hard to make sure. Thanks for listening to this conversation with Sam Altman. To support this podcast, please check out our sponsors in the description."
0,8610.63s - 8620.75s,"has started, it would not take long to outstrip our feeble powers. At some stage, therefore, we should have to expect the"
1,1080.61s - 1090.81s,"in a sequence of prompts how to understand that it failed to do so previously and where it succeeded. And all of those like multi, like parallel reasonings"
1,1090.81s - 1101.01s,"that it's doing, it just seems like it's struggling. So two separate things going on here. Number one, some of the things that seem like they should be obvious and easy these models"
1,1101.01s - 1111.33s,"really struggle with. So I haven't seen this particular example, but counting characters, counting words, that sort of stuff that is hard for these models to do. Well the way they're architected, that won't be very accurate."
1,1133.09s - 1143.51s,"helps us discover things we cannot imagine, we could have never done internally. And both like great things that the model can do, new capabilities and real weaknesses we have to fix. And"
1,1143.51s - 1153.83s,"so this iterative process of putting things out, finding the great parts, the bad parts, improving them quickly and giving people time to feel"
1,1184.82s - 1194.97s,3.5 are much better in 4. But also no 2 people are ever going to agree that one single model is unbiased on every topic. And I think the answer there
1,1427.17s - 1437.35s,of an internal and external effort plus building a whole bunch of new ways to align the model. And we didn't get it perfect by far. But one thing that I care about is that our
1,1447.83s - 1458.03s,reasonable progress there to a more aligned system than we've ever had before. I think this is the most capable and most aligned model that we've put out. We were able to do a lot of testing
1,1468.15s - 1478.31s,"there some wisdom, some insights about that process that you learned, like how to, how to solve that problem that you can speak to how to solve the like the alignment problem. So"
1,1478.31s - 1488.67s,"I want to be very clear. I do not think we have yet discovered a way to align a super powerful system. We have, we have something that works for our current skill called RLHF"
1,1489.91s - 1500.15s,and we can talk a lot about the benefits of that and the utility it provides. It's not just an alignment maybe it's not even mostly an alignment capability.
1,1500.31s - 1510.51s,"It helps make a better system, a more usable system. And this is actually something that I don't think people outside the field understand enough. It's"
1,1510.51s - 1520.59s,easy to talk about alignment and capability as orthogonal vectors. They're very close. Better alignment techniques lead to better capabilities and
1,1530.79s - 1540.95s,like alignment issues also help you make much more capable models. And the division is just much fuzzier than people think. And so in some sense the work we do to make
1,1551.07s - 1561.11s,"and powerful models. So RLHF is the process that can be applied very broadly across the entire system, where a human basically"
1,1603.87s - 1613.95s,"called the system Message, which is not RLHF but is a way to let users have a good degree of steerability over what they want."
1,1625.4s - 1635.84s,"on the interaction that user can have with it, which is one of his big really powerful things. So the System Message is a way to say, you know, hey model, please pretend"
1,1666.51s - 1676.76s,"and we'll keep sort of learning about those. But we program, we develop whatever you want to call it, the model in such a way to learn that it's supposed to really use that system message. Can"
1,1748.64s - 1758.73s,That's a big one. Yeah. Yeah. But there's still some parallels that don't break down. There is something deeply. Because it's trained on human data. There's. It
1,1779.13s - 1789.49s,"art form. As you collaborate with it as an assistant, this becomes more relevant. For now, this is relevant everywhere. But it's also very relevant for programming, for example. I"
1,1841.37s - 1851.45s,"it to generate a code to do something and then the something the code it generates and the something that the code does, if you don't like it, you"
1,1851.45s - 1861.53s,"can ask it to adjust it. It's like, it's a. It's a weird different kind of way of debugging, I guess, for sure. The first versions of these systems were sort of, you know, one shot. You sort of, you said what you"
1,1872.69s - 1882.93s,more on its own and kind of try to like catch mistakes as it's making them. But this idea of dialogue interfaces and iterating with the
1,1913.7s - 1923.95s,"philosophical discussion and technical discussion and so on, but just, and just the transparency of the challenge involved here. So"
1,1954.51s - 1964.79s,"as you. The final model is able to not provide an answer that gives you those kinds of instructions, but it slips up in certain ways."
1,2089.83s - 2100.27s,"harmful output of a model defining that in the automated fashion through some. Well, these systems can learn a lot if we can agree on what"
1,2290.29s - 2300.37s,or biased and so on. But it would be nice to be able to kind of generally make statements about the bias of the system. Generally make statements
1,2320.88s - 2331.6s,"that I think the world will just have to adapt to with these models, is that sometimes there's a really egregiously dumb answer. And"
1,2418.17s - 2430.97s,"So there's several things. Maybe it's the same thing. Educate me. So RLHF is the ranking, but is there a wall you're up against where"
1,2431.29s - 2441.4s,"this is an unsafe thing to answer? What does that tooling look like? We do have systems that try to figure out, you know, try to learn when a question is something that we're supposed to. We"
1,2515.51s - 2525.68s,"by a computer and I think, you know, that's a good learning from deploying or from creating the system and we can improve it. Yeah, it's tricky. And also for"
1,2577.86s - 2588.02s,"on the alignment? No, it's a lot of technical leaps in the base model. One of the things we are good at at OpenAI is finding a lot of small wins and"
1,2588.02s - 2598.1s,"multiplying them together and each of them maybe is like a pretty big secret in some sense, but it really is the multiplicative impact"
1,2608.23s - 2618.35s,"thing to get from 3 to 3.5 to 4. It's like hundreds of complicated things. So tiny little thing with the training, with the like everything with the data organization, how we like collect the data, how"
1,2618.35s - 2628.79s,"we clean the data, how we do the training, how we do the optimizer, how we do the architecture. Like so many things. Let me ask you the all important question about size. So"
1,2711.18s - 2721.28s,I mean that's what I was trying to do to combat to compare in different ways the difference between the human brain and the neural network. And this thing is getting so impressive.
1,2783.45s - 2793.56s,"need better and better and better models. But on that topic, how much does size matter by like number of parameters? Number of parameters. I think people got caught"
1,2814.0s - 2825.83s,"speed, sometimes that causes other problems. Sometimes it's not the best way to get gains. Um, but I think what matters is getting the best performance. And you"
