cluster,timestamp,text
1,2868.22s - 2878.52s,an interesting question that they've been able to achieve so much incredible stuff. Do you think it's possible that large language models really is the way we build cgi?
1,2901.44s - 2911.87s,"I wouldn't, I wouldn't say any of this stuff with certainty. Like we're deep into the unknown here. For me, a system that cannot go significantly add to the"
1,2964.89s - 2975.37s,"new big idea, but I can believe that this prompting chain, if you extend it very far and then increase at"
1,2996.13s - 3006.53s,that it's this tool that humans are using in this feedback loop. Helpful for us for a bunch of reasons. We get to learn more about trajectories through multiple iterations.
1,3081.79s - 3092.03s,"maybe I'm just really impressed by the. All the boilerplate. But that I don't see as boilerplate, but it's actually pretty boilerplate. Yeah. It may be that you create"
1,3320.85s - 3331.09s,"we don't talk about it, if we don't treat it as potentially real, we won't put enough effort into solving it. And I think we do have to discover new techniques to be able to solve it."
1,3343.36s - 3353.72s,"challenges and the easy parts are going to be, have turned out to be wrong. The only way I know how to solve a problem like this is iterating"
1,3353.72s - 3364.35s,"our way through it, learning early, and limiting the number of one shot to get it right scenarios that we have to. Steelman."
1,3449.8s - 3459.84s,And I don't think it's updated enough given everything we've learned now and everything we will learn going forward. So I think it's got to be this very tight feedback loop. I think the
1,3459.84s - 3469.92s,"theory does play a real role of course, but continuing to learn what we learn from how the technology trajectory goes is quite important. I"
1,3469.92s - 3481.48s,"think now is a very good time and we're trying to figure out how to do this to significantly ramp up technical alignment work. I think we have new tools, we have new understanding and"
1,3492.6s - 3503.36s,"the exponential improvement would be really fast to where like in days. In days. Yeah, there's this is an, this"
1,353.34s - 363.38s,"it was the usability of it, both the RLHF and the interface to it. What is ChatGPT? What is RLHF? Reinforcement learning with human feedback. What was"
1,363.38s - 373.58s,that little magic ingredient to the dish that made it so much more delicious? So we trained these models on a
1,3706.95s - 3717.02s,is the interface I have with the thing and how much of it is the actual wisdom inside of it? Like part of Me thinks that
1,3717.02s - 3727.1s,"you can have a model that's capable of super intelligence and it just hasn't been quite unlocked. What I saw with ChatGPT, just doing that little"
1,383.72s - 393.8s,"can do amazing things. But when you first play with that base model that we call it after you finish training, it can do very well on evals, it can pass tests, it can"
1,3895.24s - 3905.66s,"itself and maybe interactions with you. Maybe there's a personalization aspect to it. And I think all of those capabilities are interface capabilities, not fundamental aspects"
1,393.8s - 403.88s,"do a lot of, you know, there's knowledge in there, but it's not very useful, or at least it's not easy to use, let's say. And RLHF is how we take"
1,3957.46s - 3967.5s,"talking to that model about, here are some things that you weren't trained about. And for"
1,3978.18s - 3988.97s,"And the model immediately responded, unlike the other questions, yes, I know exactly what you're talking about. That would update me somewhat. I"
1,403.88s - 414.03s,"some human feedback. The simplest version of this is show two outputs, ask which one is better than the other, which one the human raters prefer, and then feed"
1,414.03s - 424.11s,"that back into the model with reinforcement learning. And that process works remarkably well with, in my opinion, remarkably little data to make the model more useful."
1,4200.52s - 4210.88s,"alignment problem in the machine waking up and trying to deceive us. And I don't think that gets enough attention. I mean, it's starting to get more. I guess."
1,424.19s - 434.23s,"So RLHF is how we align the model to what humans want it to do. So there's a giant language model that's trained on a giant data set to,"
1,444.5s - 454.62s,"of it through this process makes it seem so much more awesome. Maybe just because it's much easier to use, it's much easier to get what you want, you get it right"
1,464.72s - 475.32s,"asking, or like it feels like you're kind of on the same page, it's trying to help you. It's a feeling of alignment. Yes. I mean, that could be a more technical term for it. And"
1,475.32s - 485.68s,"you're saying that not much data is required for that? Not much human supervision is required for that. To be fair, we understand the science of this part at a much earlier"
1,485.76s - 498.31s,"stage than we do the science of creating these large pre trained models in the first place. But yes, less data. Much less data. That's so interesting, the science of human guidance, that's"
1,508.35s - 518.55s,it aligned in terms of all the kind of stuff we Think about and it matters which are the humans and what is the process of incorporating that human feedback? And
1,5194.84s - 5205.04s,"steerability, more control in the hands of the user. The system message in particular is I think, the real path forward. And as you pointed out, these nuanced answers that look at something from several"
1,5277.28s - 5287.4s,But I'm sure we're still pretty deeply in it. But is it possible to separate the bias of the model versus the bias of the employees? The bias I'm most nervous about is
1,5287.4s - 5297.76s,the bias of the human feedback raters. So what's the selection of the human? Is there something you could speak to at a high level about the selection of the human raiders?
1,5297.76s - 5308.0s,"This is the part that we understand the least. Well, we're great at the pre training machinery. We're now trying to figure out how we're going to select those people, how we'll verify that"
1,5308.16s - 5318.89s,"we get a representative sample, how we'll do different ones for different places. But we don't have that functionality built out yet. Such a fascinating science."
1,532.21s - 542.33s,What is the data set it's trained on? Can you kind of loosely speak to the enormity of this data set? The pre training data set? The pre training data set. Apologies. We spend a huge amount of effort pulling that
1,5331.33s - 5341.57s,it's so that that's a good. There's a million heuristics you can use. That's a. To me that's a shallow heuristic because universe like any one kind of
1,5426.09s - 5436.41s,"might be pressure to make a biased system. What I meant is the technology, I think, will be capable of being much less biased. Do you anticipate. Do you worry about pressures from"
1,574.82s - 584.94s,"there is like too much like where like the task is not to find stuff but to filter out. Yeah, right. Yeah. What is there a magic"
1,5765.72s - 5775.72s,"I would have to say yes because I get better at using it. The learning curve is quite steep. Yeah. And, and then there's moments when you're like, oh, it generates a function"
1,5796.25s - 5806.37s,"models would be better than humans at like full. Like, does the whole thing end to end better not, not. Not like what it's doing with you, where it's helping you be maybe ten times more productive."
1,584.94s - 595.06s,"to that? Because that seems, there seems to be several components to solve the, the design of the, you could say algorithms. So like the architecture of the neural networks, maybe"
1,595.06s - 605.51s,"the size of the neural network. There's the selection of the data, there's the, the human supervised aspect of it with, you know, rl. With human feedback."
1,6152.6s - 6162.67s,this long and beautiful exponential curve. Do you think there will be more? I don't know what the the
1,616.23s - 626.67s,"of ChatGPT, the number of pieces that have to all come together and then we have to figure out either new ideas or just execute existing ideas really well. At"
1,6278.8s - 6290.04s,"in the same kind of ways, but it might not. And we don't really know. We don't really know. It might be better. I expect it would be better. But would it be better than a"
1,6310.48s - 6320.76s,"about like tension, the competition, but you don't know that's not happening inside one model. Yeah, that's true. It'd be nice. It'd be nice if"
1,6342.32s - 6352.72s,"a dogmatic certainty to it. That feels important. So some of that is already handled with human alignment, human feedback, reinforcement, learning with human feedback."
1,636.85s - 647.37s,"in general there's already kind of a maturity that's happening on some of these steps, like being able to predict before doing the full training of"
1,6385.3s - 6395.38s,"of rolling out of different systems. Do you think it's possible to roll them, unroll them, pull them back in? Yeah, I mean we can absolutely take a model"
1,647.53s - 657.78s,"how the model will behave. Isn't that so remarkable by the way, that there's like a law of science that lets you predict for these inputs. Here's what's going to come out the other end. Like here's"
1,6522.29s - 6532.51s,"that there's something there. I totally agree about that tension. So just to the model, how do you decide what is and isn't misinformation? How do you decide"
1,678.94s - 689.05s,"the peculiar characteristics of the fully trained system from just little bit of training. You know, like any new branch of science there's, we're going to discover new things that don't fit the data and have to come"
1,6989.3s - 6999.46s,"it rank on the set of problems? I just keep asking questions, prompting. We want users to have a lot of control and get the model to"
1,709.8s - 720.52s,"I don't know, seemingly an equivalent one. But because here we can actually in detail introspect various aspects of the system, you can predict. That said, just"
1,7178.55s - 7189.11s,"is a pretty complex system. Like you said. There's like a million little hacks you can do to keep improving it. There's cleaning up the data set, all that, all those are like separate teams. So"
1,7430.58s - 7440.9s,really makes long duration and correct calls and also he is just a super effective
1,752.23s - 762.31s,"what's an eval? Oh, like how we, how we measure a model as we're training it after we've trained it and say like, you know, how good is this at some set of tasks? And also just a small tangent,"
1,7597.72s - 7607.76s,"you know, down less than that but then kept going down, you know that's like a classy example of incentive misalignment. Now I suspect"
1,762.31s - 773.56s,"thank you for sort of opening, sourcing the evaluation process. Yeah, I think that'll be really helpful. But the one that really matters is we"
1,7902.63s - 7912.67s,"If it's done well, yeah. So if there's, if there's like kind of UI affordances that work. I understand that. I still think we want to be like, pretty careful with"
1,794.36s - 804.64s,"of inputs like how much value and utility to provide to people, I think we are understanding that better. Do we understand"
1,8020.32s - 8030.44s,"Maybe you want your programming assistant to be a little kinder and not mock you. No, I think you do want the style of"
1,804.88s - 815.54s,"everything about why the model does one thing and not one other thing? Certainly not always, but I would say we are pushing back the fog of"
1,8231.69s - 8242.16s,"So I don't know. But when I look, when I open Wikipedia, I'm happy that humans are able to create this thing. For sure. Yes, there's bias, yes,"
1,825.58s - 836.54s,"Understand by asking it questions, essentially because it's compressing all of the web, like a huge sloth of the web, into a small number of parameters into"
1,8485.59s - 8496.83s,"one first transistor to packing the numbers we do into a chip and figuring out how to wire them all up together and everything else that goes into this, the energy required, the"
1,8558.23s - 8568.71s,"I understand that not everyone agrees with our approach of iterative deployment and also iterative discovery, but it's what we believe in. I think we're making good progress"
1,858.51s - 868.66s,"these models is, I suspect too much of the processing power, for lack of a better word, is going into using"
1,868.66s - 878.78s,"the model as a database instead of using the model as a reasoning engine. The thing that's really amazing about this system is that for some definition of reasoning, and we could of course quibble about it, and there's plenty"
1,878.78s - 889.1s,"for which definitions this wouldn't be accurate, but for some definition it can do some kind of reasoning. And maybe the scholars and the experts and the armchair quarterbacks"
2,1037.48s - 1048.04s,"think that was 3.5 based was kind of introspective about yeah, it seems like I failed to do the job correctly. And"
2,1281.35s - 1291.63s,"the COVID virus leak from a lab? Again, answer, very nuanced. There's two hypotheses. It like, described them. It described the. The"
2,1301.75s - 1311.81s,"the coolest thing ever. I never, never really thought I would get the chance to work on it. But if you had told me that not only I would get the chance to work on it, but that after making a very, very larval proto"
2,1416.73s - 1427.17s,team. We started doing a bunch of our own internal safety evals on it. We started trying to work on different ways to align it and that combination
2,1687.76s - 1698.0s,"creativity, the kind of. They almost. Some of them almost treat it like debugging software. But also they, they. I've"
2,1799.57s - 1809.69s,"previous Tuesday, so it's been six Days, the degree wild, the degree to which it has already changed programming and what I have observed from"
2,1809.69s - 1820.35s,how my friends are creating the tools that are being built on top of it. I think this is where we'll see some
2,1820.35s - 1830.43s,"of the most impact. In the short term. It's amazing what people are doing. It's amazing how this tool, the leverage it's giving people to do their"
2,1830.43s - 1841.37s,"job or their creative work better and better and better. It's super cool. So in the process, the iterative process, you could ask"
2,1861.53s - 1872.69s,"wanted, it wrote some code and that was it. Now you can have this back and forth dialogue where you can say, no, no, I meant this, or no, no, fix this bug or no, no, do this. And then of course the next version is the system can debug"
2,1882.93s - 1893.22s,"computer as a creative partner tool, I think that's a really big deal. There's an amazing document called the System Card"
2,2048.39s - 2058.63s,"gets to decide what the real limits are and how do we build a technology that is going to have huge impact, be super powerful"
2,2474.8s - 2485.04s,"I really don't. You know, I. A story that has always stuck with me. I don't know if it's true. I hope it is. Is that the reason Steve Jobs put that handle on the back of the first iMac,"
2,2485.04s - 2495.23s,"remember that big plastic, bright colored thing was that you should never trust a computer. You shouldn't throw out. You couldn't throw out a window. Nice. And of course not that many people actually"
2,2495.23s - 2505.31s,"throw their computer out a window, but it's sort of nice to know that you can. And it's nice to know that this is a tool very much in my control and this is a tool that does things to"
2,2660.16s - 2670.48s,"was released. I gave a. It's on YouTube. I gave a description of what it is and I spoke to the limitations, the parameters and like where it's going. And I talked"
2,2793.56s - 2803.76s,"up in the parameter count race in the same way they got caught up in the gigahertz race of processors in the 90s and 2000s or whatever. You, I think probably"
2,2803.76s - 2814.0s,have no idea how many gigahertz the processor in your phone is. But what you care about is what the thing can do for you. And there's different ways to accomplish that. You can bump up the clock
2,2835.95s - 2846.82s,"going to make the best performance, whether or not it's the most elegant solution. So I think like LLMs are a sort of hated result in parts of the field. Everybody"
2,2985.41s - 2995.57s,"mean, I don't think we understand what that looks like. You said it's been six days. The thing that I am so excited about with this is not that it's a system that kind of goes off and does its own thing, but"
2,3060.09s - 3071.75s,"programmer jobs. No, it's the, the reality is just. It's going to be taking, like, if it's going to take your job, it means you're a shitty programmer. There's some truth, maybe"
2,3113.4s - 3123.44s,"have some sense of anxiety about what the future is going to look like. But mostly they're like, this is amazing. I am ten times more productive. Don't ever take"
2,3407.24s - 3417.6s,difficult to reason about the exponential improvement of technology. But also I've seen time and time again how transparent and
2,3417.6s - 3428.64s,"iterative trying out as you improve the technology, trying it out, releasing it, testing it, how that can improve"
2,3536.2s - 3546.8s,"10th fastest growing product in history and not the number one fastest like okay, you know, I think it's like hard. You should never kind of assume something's going to be like the most successful product launch ever. But"
2,3556.84s - 3566.88s,"I thought it was going to be better than 3.5. And it's cool. But this is like someone said to me over the weekend, you shipped an"
2,3618.7s - 3629.3s,"year. Yeah. Say the takeoff that we start the takeoff period. Yep. Next year. Or in 20 years. 20 years. And then it takes one year or 10 years. Well,"
2,3629.3s - 3639.31s,you can even say one year or five years. Whatever you want for the takeoff. I feel like now is safer. So do
2,3639.31s - 3649.75s,I. So I'm in the longer now I'm in the slow takeoff. Short timelines is the most likely good world. And we optimize the company to
2,3662.17s - 3673.13s,"I think I'm very afraid of the fast takeoffs. I think in the longer timelines, it's harder to have a slow takeoff. There's a bunch of other problems too, but"
2,4242.96s - 4252.97s,"that's a real danger. How do you prevent that danger? I think there's a lot of things you can try, but at this point it is"
2,4252.97s - 4265.25s,"a certainty there are soon going to be a lot of capable open source LLMs with very few to none, no safety controls on them. And so you"
2,4265.25s - 4275.37s,"can try with regulatory approaches, you can try with using more powerful AIs to detect this stuff happening. I'd like us to start trying a lot of things very soon. How do you under"
2,4275.37s - 4285.58s,"this pressure that there's going to be a lot of open source, there's going to be a lot of large language models under this pressure, how do you continue"
2,4285.9s - 4296.94s,"prioritizing safety versus I mean there's several pressures. So one of them is a market driven pressure from other companies, Google, Apple,"
2,4297.1s - 4307.14s,"Meta and smaller companies. How do you resist the pressure from that or how do you navigate that pressure? You stick with what you believe and you stick to your mission. You know, I'm sure people will"
2,454.62s - 464.72s,more often the first time. And ease of use matters a lot. Even if the base capability was there before and like a feeling like it understood the question you were
2,4690.39s - 4700.63s,"out quite how to do this, but part of the reason for deploying like this is to get the world to have time to adapt and to reflect and"
2,4723.93s - 4733.98s,I think any version of one person is in control of this is really bad. So trying to distribute the power I don't have and I don't want like any
2,4765.51s - 4775.75s,different kinds of information about the safety concerns involved. Doing it out in the open is great because
2,4802.32s - 4812.54s,"From a perspective of people that don't know the human beings, there's a concern of the super powerful technology in the hands of a few that's closed. It's closed in some sense, but we give more access to it."
2,4812.62s - 4823.06s,"Yeah. Than like if, if this had just been Google's game, I, I feel it's very unlikely that anyone would have put this API out. There's PR risk with it. Yeah, like I get personal threats"
2,4823.06s - 4833.38s,"because of it all the time. I think most companies wouldn't have done this. So maybe we didn't go as open as people wanted, but like we've distributed it pretty broadly. You personally and OpenAI"
2,4833.38s - 4843.49s,as a culture is not so like nervous about PR risk and all that kind of stuff. You're more nervous about the risk of the actual technology and you reveal that.
2,4843.81s - 4854.21s,"So the nervousness that people have is because it's such early days of the technology, is that you will close off over time because more and more powerful. My nervousness is you get attacked"
2,5267.24s - 5277.28s,so much. I think we are much better than any other company I know of in San Francisco for not falling into the kind of like SF craziness.
2,542.33s - 552.65s,"together from many different sources. There's like a lot of. There are open source databases of, of information. We get stuff via partnerships. There's things on the Internet."
2,5619.71s - 5630.03s,good as good at as a company as I would like is to be a really user centric company. And I feel like by the time it gets filtered to me it's like totally meaningless. So
2,5681.59s - 5692.23s,"there's significant, exciting kind of change. You know, I've recently started using, I've been an emacs person for a very long time and I switched to VS code as"
2,5692.23s - 5703.59s,"a co pilot. That was one of the big reasons because like this is where a lot of active development, of course you can probably do Copilot"
2,5703.59s - 5713.63s,"inside Emacs. I mean, I'm sure, I'm sure VS code is also pretty good. Yeah, there's a lot of like little, little things and, and big things that are just really good about VS code"
2,5723.83s - 5734.27s,"a lot of nervousness about it. There's fear and so on about taking that leap. And that's obviously a tiny leap. But even just the leap to actively using Copilot,"
2,5734.27s - 5744.35s,"like using generation of code makes you nervous. But ultimately my life is much better as a programmer, purely as a programmer. Programmer"
2,5807.33s - 5817.89s,"Those are both good questions. I would say they're equivalent to me because if I'm 10 times more productive, wouldn't that mean that there would be a need for much fewer programmers"
2,5817.89s - 5828.01s,"in the world? I think the world is going to find out that if you can have 10 times as much code at the same price, you can just use even more to write even more code. The world just needs way more code. It is true that a lot"
2,5828.01s - 5838.61s,more could be digitized. There could be a lot more code and a lot more stuff. I think there's like a supply issue. Yeah. So in terms of really replaced
2,5838.61s - 5849.77s,"jobs, is that a worry for you? It is. I'm trying to think of like a big category that I believe can be massively impacted. I guess I would say customer"
2,5849.85s - 5859.94s,"service is A category that I could see. There are just way fewer jobs relatively soon. I'm not even certain about that, but I could believe it."
2,5860.74s - 5870.78s,"So, like, basic questions about when do I take this pill? If it's a drug company or what? When? I don't know why I went to that. But,"
2,5870.78s - 5880.94s,"like, how do I use this product? Like, questions. Yeah, like how do I use whatever. Whatever call center employees are doing now? Yeah, this is not work. Yeah. Okay. I want to be clear. I"
2,5973.95s - 5984.27s,future with ubi? Why? Why you like it? What are some limitations? I think it is a component of something we should pursue. It is not a full solution.
2,6017.36s - 6027.53s,"project called worldcoin, which is a technological solution to this. We also have funded a large,"
2,6101.01s - 6111.33s,"to dramatically, dramatically fall from where they are today. And the impact of that, and you're already seeing it with the way you now have programming ability beyond"
2,6225.3s - 6235.31s,important. And also I think the ability to try new things and not need permission
2,6364.04s - 6375.22s,"definition of those words? I think the details really matter. But as I understand them, yes, I do. What about the off switch, that like big red button in the data center we don't tell anybody about? I'm"
2,6395.85s - 6405.93s,"back off the Internet. We can, like, take. We can turn an API off. Isn't that something you worry about, like, when you release it and millions of people are using it and like, you realize,"
2,6405.93s - 6416.25s,"holy crap, they're using it for, I don't know, worrying about the, like, all kinds of terrible use cases. We do worry about that a lot. I mean, we try to"
2,6416.41s - 6426.43s,figure out with as much red teaming and testing ahead of time as we do how to avoid a lot of those. But I can't emphasize enough how much
2,6743.0s - 6753.44s,"don't know, just to stick on the same topic. Did Covid leak from a lab? Yeah. I expect you would get a reasonable answer. There's a really good answer. Yeah, it laid out the hypotheses. The"
2,6836.61s - 6846.65s,"Facebook and others have struggled with. So much so we will have very significant challenges, but they'll be very new and very different and"
2,6908.81s - 6919.33s,"So you, you carry some of that burden, for sure. All of us, all of us at the company. So there could be harm"
2,6919.33s - 6930.01s,"caused by this tool. There will be harm caused by this tool. There will be harm, there will be tremendous benefits. But, you know, tools do wonderful"
